{
  "project": "GTPJ",
  "version": "2026-06-20",
  "current_version": "v5",
  "ideas": [
    {
      "idea_id": "IDEA-0001",
      "idea_dir": "idea_tree/ideas/IDEA-0001_clip_a_self_text_prototype/",
      "title": "CLIP-A-self text prototype adapter",
      "status": "validated",
      "source_type": "paper",
      "source_ref": "paper:Enhancing CLIP with GPT-4; code:https://github.com/mayug/VDT-Adapter",
      "source_status": "verified",
      "global_score": 82.0,
      "core_summary": "用 CLIP-A-self 对 seen-class GPT/VDT 句子描述做自注意力聚合，增强文本原型适配器，同时保持 GZSL 接口不变。",
      "version_scores": {
        "v1": {
          "score": 78.0,
          "applicability": "needs_adaptation",
          "stage": "validated",
          "rationale": "v1 already uses GPT/VDT sentence averages and an MLP text adapter for seen prototypes. CLIP-A-self can test whether sentence-level self-attention selects more useful VDT cues while preserving the existing GZSL label mapping, class order, logits shape, and seen-only CE training path.",
          "blockers": []
        },
        "v2": {
          "score": 82.0,
          "applicability": "direct",
          "stage": "validated",
          "rationale": "IDEA-0001 was promoted into the active GTPJ-v2 mainline by owner decision on 2026-06-27 using TRIAL-001 ATTEMPT-019. It is no longer a pending v2 candidate; future v2 work should focus on confirmation, U/S gap analysis, and ablations around the accepted adapter.",
          "blockers": []
        },
        "v3": {
          "score": 80,
          "applicability": "direct",
          "stage": "validated",
          "rationale": "IDEA-0001 is inherited by GTPJ-v3 from the accepted v2 code path; it remains part of the mainline stack but is not the new v3 delta.",
          "blockers": []
        },
        "v4": {
          "score": 80,
          "applicability": "direct",
          "stage": "validated",
          "rationale": "Inherited by GTPJ-v4 from the v3 code path; local-v3-054 changes only tuned config weights, not the PSE interface.",
          "blockers": []
        },
        "v5": {
          "score": 80,
          "applicability": "direct",
          "stage": "validated",
          "rationale": "Inherited by GTPJ-v5; v5 activates conditional BVSA text and tuned PSE/local weights but keeps the PSE interface and legacy aliases intact.",
          "blockers": []
        }
      },
      "base_versions": [
        "v1",
        "v2",
        "v3",
        "v4",
        "v5"
      ],
      "based_on_modules": [
        "v1_text_adapter",
        "VDT-Adapter CLIP-A-self"
      ],
      "target_component": "seen-class text prototype adapter in model/MyModel.py",
      "hypothesis": "Replacing the v1 MLP seen-text adapter with a sentence-level CLIP-A-self adapter can learn a better aggregation of GPT/VDT descriptions for seen classes, improving GZSL H or ZS without changing class order, seen/unseen split, label mapping, logits shape, or evaluation semantics.",
      "expected_effect": {
        "U": "should not drop materially because unseen prototypes stay raw sentence means in TRIAL-001",
        "S": "may improve if seen prototypes use more discriminative VDT cues",
        "H": "target metric; promote only with complete evidence and no interface pollution"
      },
      "implementation_scope": "TRIAL-001 only changes the text prototype construction path: preserve sentence-level GPT/VDT embeddings, apply CLIP-A-self to seen class sentence sets, keep an outer prototype residual against the raw sentence mean, and leave unseen prototypes as raw sentence means by default.",
      "risk": "A seen-only CE signal can overfit the adapter toward seen categories and pull text prototypes away from the original CLIP/VDT space. L2SP is not part of TRIAL-001; it is recorded only as a follow-up ablation/anchoring question if prototype drift appears.",
      "compatibility": "The switch-off path must keep the existing v1 MLP adapter behavior and the same forward/loss/eval interfaces. New parameters are trial-local and should load older checkpoints with strict=False only when intentionally used.",
      "transfer_notes": "For future versions, re-check whether the text prototype owner is still model/MyModel.py and whether v2 keeps the same GPT/VDT sentence source and seen/unseen split semantics before reusing this idea.",
      "priority": 0.78,
      "linked_trials": [
        "experiments/module_trials/IDEA-0001_clip_a_self_text_prototype/TRIAL-001_clip_a_self_residual_seenonly"
      ],
      "linked_versions": [
        "v2",
        "v3",
        "v4",
        "v5"
      ],
      "linked_experiments": [],
      "evidence": [
        {
          "type": "paper",
          "ref": "C:/Users/Administrator/Desktop/CV璁烘枃/2023/Enhancing CLIP with GPT-4锛欻arnessing Visual Descriptions as Prompts.pdf",
          "note": "PDF abstract states the code, prompts, and auxiliary text dataset are available at github.com/mayug/VDT-Adapter."
        },
        {
          "type": "code",
          "ref": "https://github.com/mayug/VDT-Adapter",
          "note": "Official code contains SelfAttnAdapter and a self_attn branch over per-class GPT/VDT sentence embeddings."
        },
        {
          "type": "trial",
          "ref": "experiments/module_trials/IDEA-0001_clip_a_self_text_prototype/TRIAL-001_clip_a_self_residual_seenonly/result.yaml",
          "note": "TRIAL-001 current formal best is ATTEMPT-019 H=74.29, promoted to GTPJ-v2 by owner decision on 2026-06-27; clean confirmation and U/S gap analysis remain follow-ups."
        }
      ]
    },
    {
      "idea_id": "IDEA-0002",
      "idea_dir": "idea_tree/ideas/IDEA-0002_fae_memory_jepa/",
      "title": "FAE-memory JEPA auxiliary loss",
      "status": "validated",
      "source_type": "user",
      "source_ref": "owner:2026-06-27:move AG-JEPA visual context after FAE while keeping FAE-pre patch target",
      "source_status": "local_heuristic",
      "global_score": 72.0,
      "core_summary": "把 JEPA 辅助损失的视觉 context 移到 FAE memory，用 FAE-enhanced context 预测 detached pre-FAE patch target。",
      "version_scores": {
        "v2": {
          "score": 72.0,
          "applicability": "needs_adaptation",
          "stage": "validated",
          "rationale": "TRIAL-002 strict main-path FAE-memory JEPA plus conditional text is accepted by owner as GTPJ-v3 despite mixed confirmation evidence; retain stochastic-variance warning.",
          "blockers": []
        },
        "v3": {
          "score": 74,
          "applicability": "direct",
          "stage": "validated",
          "rationale": "Accepted as the GTPJ-v3 delta by owner decision on 2026-06-28. Best observed ATTEMPT-004 H=74.27; clean seed-42 reruns H=74.14 and H=74.01 show stochastic variance, so confirmed_H remains pending.",
          "blockers": []
        },
        "v4": {
          "score": 74,
          "applicability": "direct",
          "stage": "validated",
          "rationale": "Inherited by GTPJ-v4 from GTPJ-v3; v4 promotes a min3-confirmed tuned configuration and does not introduce a new IDEA-0002 code path.",
          "blockers": []
        },
        "v5": {
          "score": 76,
          "applicability": "direct",
          "stage": "validated",
          "rationale": "TRIAL-003 通过把 all_text_cond 路由到 BVSA cross/local_score 扩展 IDEA-0002。Owner 已把 main100 最佳候选激活为 GTPJ-v5；更强的正式 confirmed reference 是 v3/CONFIRM-001 local-v3-054 confirmed_H=74.47。",
          "blockers": []
        }
      },
      "base_versions": [
        "v2",
        "v3",
        "v4",
        "v5"
      ],
      "based_on_modules": [
        "GTPJ-v2 AG-JEPA",
        "FAE geometry-aware visual memory",
        "CLIP-A-self seen text adapter"
      ],
      "target_component": "AG-JEPA auxiliary loss path in model/MyModel.py",
      "hypothesis": "Using FAE-enhanced visual memory as JEPA context while keeping the prediction target as detached pre-FAE patch_z should make AG-JEPA regularize the main visual memory path without changing class order, seen/unseen split, logits shape, or evaluation semantics.",
      "expected_effect": {
        "U": "may improve if FAE memory learns class-conditioned visual evidence that transfers to unseen classes",
        "S": "should remain comparable if seen-class text and CE label mapping are unchanged",
        "H": "target metric; any improvement remains trial evidence until clean confirmation"
      },
      "implementation_scope": "Add trial-local JEPA context/text modes. ATTEMPT-001 keeps fae_memory as a keep-only FAE recomputation path. ATTEMPT-002 adds fae_main_memory, which mean-pools kept positions from the main forward path jepa_memory, and jepa_text_mode=conditional, which feeds sample-conditioned text into positive and negative AG-JEPA predictor branches.",
      "risk": "Strict main-path jepa_memory can leak masked-token information through FAE self-attention; conditional text lengthens the gradient path through meta_net; lastvit-selected patch alignment must remain explicit; negative loss should keep visual context detached.",
      "compatibility": "Switch-off or jepa_context_mode=embed plus jepa_text_mode=adapted must preserve the current AG-JEPA path. The forward output can include extra auxiliary keys, but logits, class order, label mapping, seen/unseen split, and metric calculation must remain unchanged.",
      "transfer_notes": "Future versions must re-check whether CrossModalTransformer still exposes embed_cv, FAE memory, and the same selected-patch semantics before reusing this idea.",
      "priority": 0.72,
      "linked_trials": [
        "experiments/module_trials/IDEA-0002_fae_memory_jepa/TRIAL-001_fae_memory_jepa",
        "experiments/module_trials/IDEA-0002_fae_memory_jepa/TRIAL-002_strict_conditional_jepa",
        "experiments/module_trials/IDEA-0002_fae_memory_jepa/TRIAL-003_conditional_bvsa_text"
      ],
      "linked_versions": [
        "v2",
        "v3",
        "v4",